news_url,news_source,title,subtitle,datetime,news_text,author,keywords
https://tw.entertainment.appledaily.com/realtime/20170914/1204035,蘋果日報,A-Lin國小長這樣！踏浪超模魂上身,,2017-09-14T12:46:00Z,A-Lin將於本月20日推出新輯《A-LIN同名專輯》，當天在松菸一號倉庫舉辦「I]m A-Lin」演唱會，近日她隨攝影團隊赴三芝祕密海灣拍攝專輯封面，赤腳踩在滾燙的沙灘，卻「超模魂」上身玩起時尚5連拍，當天A-Lin凌晨2點開始妝髮，清晨5點上工，面臨8月酷暑逼人，攝氏39度豔陽下把團隊20名工作人員曬到眼花，A-Lin卻樂得像小女孩，2小時便完工。新歌《光之海》18日在中廣流行網、iRadio線上聽首播，談到大海，她感性地說：「大海是我人生的第一個歌迷。」她從小常在台東家鄉的海邊又唱又跳，阿美族的她聽父母唱原住民古調，也聽哥哥姊姊們帶來的西洋歌手卡帶，笑說常想像自己是瑪丹娜，也在小時候就立志當歌手。這首新歌她改以中低音的溫暖聲線詮釋，緩緩唱出自己築夢的過程，以及對歌迷滿滿的感謝，也希望能鼓舞每個努力尋找舞台的人，用歌聲做為最溫暖的陪伴，並告訴他們「並不孤單」。（陳薈涵／台北報導）</i rame>,陳薈涵,娛樂
http://tw.entertainment.appledaily.com/daily/20170912/37778427/,蘋果日報,王樂妍好身材害NG Gino也太沒用,,2017-09-11T21:00:00Z,"民視校園喜劇《我的老師叫小賀》昨辦殺青酒，該劇從去年4月開播，至9月13日完結篇。阿霞看「小賀老師」王樂妍穿露背裝現身，大方放送美背。
莫非故意重來
該劇外景不少，包括攝氏零下10度的日本仙台、40度高溫的三芝海邊，簡直是「哪裡冷往哪裡去、哪裡熱往哪裡去」。王樂妍跟阿霞說拍殺青戲會穿婚紗，看似是美麗登場，但她卻說拍得超級痛苦，因為她最討厭穿馬甲婚紗，一整天都苦不堪言，對戲的Gino說因她身材太好，讓他頻頻NG。阿霞猜Gino該不會是故意NG，看個過癮吧。",,娛樂
https://tw.news.appledaily.com/life/realtime/20170905/1197667,蘋果日報,新北動物之家普渡　為往生毛寶貝祈福,,2017-09-05T09:52:00Z,農曆7月15日為「中元節」，除普渡祭拜好兄弟之外，新北市動保處於今日舉辦8處動物之家聯合普渡，為毛寶貝祭祀祈福，讓往生的流浪動物可以安息，更祈求未來動物之家內的毛寶貝健康、幸福、快樂，早日找到主人。新北市動保處今日舉行動物之家聯合普渡，同時間中和、新店、五股、三芝、八里、瑞芳、淡水七處動物之家也同步辦理祭拜，共同祭悼往生的毛寶貝好兄弟。普渡桌上擺放毛寶貝愛吃的飼料、罐頭及平日裡不常吃到的零食，希望能讓牠們飽食一餐，同時也祈求未來園區內的毛寶貝健康平安，早日找到屬於自己的幸福。新北市農業局長李玟表示，每年中元普渡動物之家皆會舉辦聯合祭拜，讓流浪動物在世界的另一端不覺得孤單，另外新北市各動物之家也提供新北市民的寵物遺體火化，板橋及中和動物之家亦可提供寵物樹葬區讓飼主掩埋寵物骨灰及悼念家中寶貝。（突發中心陳威叡／新北報導）看了這則新聞的人，也看了……貨車撞殘機車騎士沒事　女車主停路邊卻GG了悚！失業父劫殺越女搶2100元　11歲兒全程目睹【遺憾片】疑感情因素想不開　基隆警員住家上吊亡,突發中心陳威叡,生活
http://tw.entertainment.appledaily.com/daily/20170902/37768315/,蘋果日報,爆同居貴婦淪負心漢 洪榮宏聲勢慘跌仰藥,,2017-09-01T21:00:00Z,"重創形象【陳薈涵╱台北報導】54歲的台語歌手洪榮宏當年是台語歌王子，2013年傳與貴婦徐俶蓉（Susan）過從甚密，導致16年婚姻告吹。當時他矢口否認出軌，去年才在教會告解對前妻陳施羽不忠，負心漢形象拖累歌唱事業，今年在台北、台南舉辦共3場演唱會，起初票房不舉，極力催票後，小賺45萬元。
罹重度憂鬱症
洪榮宏接連爆出和Susan同居、不見陳施羽及兒女等負面新聞，隔年和陳施羽簽字離婚，事業也陷入低潮。他回到三芝陪媽媽，但抑鬱難解，曾吞下5、60顆安眠藥企圖輕生，就醫後發現罹患重度憂鬱症，服藥2年才好轉。
酗酒破壞金嗓
有唱片宣傳直指他酗酒害嗓，創作人陳百潭在臉書直指洪榮宏：「喝酒喝到聲音變很差，怕好的歌被他唱壞。」陳施羽昨表示：「洪大哥是國寶級歌手，歌手在現場演唱時，會受很多因素影響，很少有人有完美演出。（他的）演唱會有許多粉絲感動落淚，應該能證明他的歌聲依然深入人心。」",陳薈涵,娛樂
https://tw.news.appledaily.com/local/realtime/20170822/1187794,蘋果日報,5度酒駕害友喪命又肇逃　「情堪憫恕」獲減刑,,2017-08-22T06:35:00Z,新北市一名鄭姓男子酒駕遭判刑，去年出獄才3個月，竟又酒駕自撞電桿，造成車內2名友人一死一傷，還畏罪逃走，他到案後賠償死者家屬獲得諒解，一審認定鄭男情堪憫恕，依酒駕致人於死等罪減刑輕判他1年10月徒刑，檢方上訴指鄭男有4次酒駕前科、不宜輕縱，但高院今仍維持原判。還可上訴。判決指出，鄭男(46歲)去年5月17日下午2時許，和黃姓男子、姚姓女子在三芝區一處宮廟裡喝酒到下午4時許，鄭男明知自己無汽車駕照且當時已有酒意，仍駕駛姚女轎車搭載姚、黃2人回家，途經山路一處左彎道，鄭男恍神偏右，車頭猛撞路邊一根電桿停住、車身嚴重變形。巨大撞擊力量造成黃男胸部與頭部挫傷、姚女胸壁與腹部疼痛，鄭男頭臉也掛彩，他撇下車內2名傷者，先躲到路邊樹林，再趁隙步行下山。黃、姚2人經路人發現報警送醫，黃因顱內出血不治。姚女原以車主身分自稱酒駕肇事，得知黃男死訊立刻改口，供出鄭男才是元兇。鄭男4天後到案全盤認罪，也承認當時看見黃男頭部在流血，但他害怕被查出無照酒駕，所以丟下朋友逃離。鄭男於偵審期間和黃男家屬達成和解，並依約賠償獲得黃男家屬原諒，同意法官從輕量刑給黃男自新機會。法官指鄭男所犯酒駕致人於死罪及肇事逃逸罪，各為至少判刑3年與1年的罪名，但鄭男犯後態度良好、甚有悔意，相較於其他酒駕肇事並逃逸案件常見否認犯行、拒絕賠償情形，鄭男確有情堪憫恕之處，一審將鄭男所犯2罪各減刑輕判1年8月徒刑與7月徒刑，合併應執行1年10月徒刑。檢方不服，上訴指出鄭男前有4次酒駕前科，出獄3個月又犯下本案，符合立法防制酒駕所要加重處罰的意旨，社會也瀰漫對於酒駕肇事零容忍的氛圍，鄭男漠視用路人生命身體安全，似不應依情堪憫恕規定輕判。高院審理認為，鄭男先前的酒駕前科，充其量是評價整體惡性的考量因素之一，並非有此前科，就一律剝奪情堪憫恕的適用機會。高院指出，一審已詳載量刑審酌事項，主要是黃男家屬同意原諒鄭男，並無逾越法律規範，據此駁回檢方上訴，全案仍可上訴最高法院。姚女所犯頂替罪另案被判刑3月、得易科罰金9萬元，因與黃男家屬達成和解，獲判緩刑2年，須支付公庫2萬元，已先定讞。(黃哲民／台北報導)【更多新聞，請看《蘋果陪審團》粉絲團】推薦新聞……駕凌志撞毀路燈落跑　車上證件很亮眼【直擊片】基平隧道火燒車　人員倉皇逃離3歲女撞油罐車頭骨碎裂、血胸　昏迷指數3急救中,黃哲民,社會
https://tw.news.appledaily.com/life/realtime/20170819/1185748,蘋果日報,金山青農引進多品種地瓜　色彩繽紛供選創商機,,2017-08-19T02:22:00Z,新北市甘藷進入盛產季節，金山區一名青年農民楊新基發揮創意，除了種植常見的台農66號紅心甘藷和台農57號黃心甘藷外，近來又增加口感香Q，富含花青素的日本品種紫玉甘藷，各種顏色的甘藷集合在一起色彩繽紛，相當吸睛也令人食指大動。北海岸淡水、三芝、石門、金山、萬里等地區背山面海，土壤略帶沙質，排水性佳，特別適合種植甘藷，每年通常在4至5月種植，8月份開始採收，且北海岸地區夏季日照充足雨量少，光合作用旺盛，生產的甘藷特別優質，香甜可口，現在吃正是時候。青年農民楊新基是金山區種植甘藷面積最大的青農代表，年輕時曾從事鐵工的他，15年前因不捨父親年邁辛勞，下定決心返鄉繼承家業種植甘藷，卻因為農村人口嚴重老化，年年面臨缺工窘況，近年來他嘗試改變，在農業局補助下引進甘藷自動插苗機，漸漸解決人力不足的問題，種植出高品質甘藷撐起一家生計，目前與家人共同經營知名店家「金山楊家紅心蕃薯」，自產自銷。楊新基表示，金山地區主要種植甘藷品種以台農66號紅心甘藷為主，產期在每年的8至11月，口感軟Q，香甜可口，為了提供消費者更多選擇，近來增加種植57號黃心甘藷，以及富含花青素的日本品種紫玉甘藷等，各種顏色甘藷集合在一起，色彩繽紛，歡迎大家來品嚐香甜可口又健康的「多彩甘藷」。農業局表示，為了解決農村人力不足的問題，新北市積極鼓勵青年農民返鄉務農，補助農友購入自動化機械協助耕作，並且每年補助農友購買甘藷種苗及生產資材，降低農友生產成本，民眾如欲購買甘藷，可洽各區農會。（突發中心曾佳俊／新北報導）,突發中心曾佳俊,生活
https://tw.finance.appledaily.com/realtime/20170818/1185175,蘋果日報,柏油鋪設斷光纜　台灣大提供受影響用戶5%月租減免,,2017-08-18T05:28:00Z,昨日台灣大在新北市淡水、三芝區3G/4G部分基站語音與數據服務，因為鋪設柏油施工造成光纜障礙受影響，台灣大今日宣布將提供受影響用戶5%的月租減免。台灣大指出，17日晚上10點13分，新北市淡水學府路道路因鋪設柏油施工，造成光纜障礙，影響到新北市淡水、三芝區3G/4G部分基站語音與數據服務的提供，經維修技術人員漏夜搶修排除障礙，於今天凌晨1點19分完成光纜搶修。台灣大表示，這起語音數據局部地區中斷事件，雖起因於舖設柏油施工，但已對部份淡水，三芝民眾造成影響，目前確切受影響人數正在統計中，而障礙原因雖不可歸責於台灣大，但公司仍決定對受影響的用戶給予5%的月租減免。（林韋伶／台北報導）,林韋伶,財經
https://tw.news.appledaily.com/life/realtime/20170818/1185100,蘋果日報,台灣大淡水三芝無預警斷訊　竟是道路施工惹禍,,2017-08-18T04:08:00Z,昨日晚間10時13分起，新北市淡水、三芝的台灣大用戶無預警3G、4G斷訊，客服電話被打爆。台灣大哥大表示，斷訊起因淡水學府路鋪設柏油施工，不慎挖斷光纜網路，經漏夜搶修已於今日凌晨1時19分排除障礙，確切受影響人數統計中，雖然並非台灣大內部疏失，基於已造成影響，決定對淡水、三芝受影響的用戶給予5%的月租減免。 NCC副主委翁柏宗表示，依照行動寬頻業務管理規則第71條，因為電信機械設備阻斷造成2小時以上訊號中斷，台哥大必須提供5%月租費補償。本次故障為道路施工單位造成，並非台哥大內部操作失誤，屬於無法控制的外力因素，因此無法歸責於台哥大。 這是台灣大哥大近三年來，第四次網路異常事件，不過前三次都屬於內部網路維運管理疏失，上一次斷訊是今年4月28日，導致部分用戶斷網近半小時。(林芳如／台北報導),林芳如,生活
https://tw.news.appledaily.com/life/realtime/20170816/1183702,蘋果日報,2G正式走入歷史　電信業者加強偏鄉涵蓋,,2017-08-16T07:51:00Z,2G業務已於今年6月30日就中止，但仍暫可透過4G門號使用GSM手機，今國家通訊傳播委員會（NCC）通過包含中華電信、遠傳、台灣大哥大3家電信業者行動寬頻事業計畫書變更，也將從8月31日正式終止上述GSM異質網路，等同2G確確實實正式走入歷史。不過，過去偏遠山區、沿海岸地帶，都仰賴涵蓋率較廣的2G系統維持通訊，NCC表示，現在中華電信已經特別針對臺三線及台九線環內區域等偏遠山區及沿海岸地帶，以涵蓋率較廣的U900基地台進行補強，並搭配原先U2100基地台，偏鄉涵蓋率已達95.25%，較過往逾8成涵蓋率還要好。NCC也提到，像是過去往來台北馬祖的台馬之星渡輪，航程沿線有200公里，常在航程中間就無法收訊，但是在中華電信於東引、北竿、三芝等處增設U900基地台，現在已經可以涵蓋台馬之星整個航程，根據中華電信計畫，目前已增設300座U900基地台，目標在年底增到600座。NCC表示，3家電信業者汰除老舊的2G系統網路設備後，估計全年可節省總電力超過3億度，等同減少1.58億噸碳排放量，對於國內電力使用、節能減碳都有助益。（朱正庭／台北報導）,朱正庭,生活
https://tw.news.appledaily.com/life/realtime/20170815/1182894,蘋果日報,讓偏鄉孩童有機會看牙醫　醫師將啟動義診,,2017-08-15T09:45:00Z,很多偏鄉小孩看牙醫機會不多，繼去年全台民眾捐出200萬元關懷偏鄉孩童的口腔健康，為屏東、嘉義、雲林、彰化、南投、桃園、台東等縣市的偏鄉小學提供口腔衛教與義診服務，今年Extra無糖口香糖再度與兒童福利聯盟文教基金會及中華民國兒童牙科醫學會合作，明起至10月3日買一包Extra，廠商就會捐出1元愛心基金，用於支持上述活動。 兒童牙科醫學會理事長李楊鈞醫師說，去年他與團隊幾乎上山下海，「我們去了桃園比山上更山上的地方，去了屏東比海邊更海邊的地方。」今年團隊計劃到訪全台至少12所偏鄉小學義診，並將於下月26日前往新北市三芝區興華國小，也會針對需要特別追蹤的小學進行第二次義診。 李楊鈞也說，無糖口香糖可達到護齒效果，因其中的木糖醇（Xylitol）能減低蛀牙風險，雖對嚴重蛀牙的患者未必有明顯效用，但另可提供一個飯後清潔牙齒的簡便方法。出席同場記者會的藝人隋棠說，早晚和飯後刷牙與定期看牙醫，是保養牙齒的法門。（實習記者盧逸文╱台北報導）,實習記者盧逸文,生活
https://tw.news.appledaily.com/life/realtime/20170810/1179554,蘋果日報,後備英雄咖啡館　化身北海岸公益中繼站,,2017-08-10T07:50:00Z,長年投身公益的石門後輔中心秘書謝憲州去年在淡水開設「北海咖啡工作室」，除咖啡豆研磨及手沖咖啡的專業指導外，也成為石門、三芝、金山、萬里及淡水5區後輔中心成員會商公益服務的基地，老人送暖等各項志願服務活動在這裡發芽並落實，讓飄散咖啡香的工作室成為北海岸公益中繼站。 新北市民政局表示，現年39歲的謝憲州是新北市石門人，從海巡署退役後便加入後備軍人幹部訓練班， 從2005年開始服務於石門後備軍人輔導中心，迄今已超過10年。 謝憲州說，北海岸各區後備人力比其他行政區更為短缺，如果能夠加強北海岸後輔中心的交流，就能提升動員的能量，剛好自己會煮咖啡，因此廣邀後輔中心成員在這裡討論弱勢關懷及災害救援事宜，在充滿咖啡香的氛圍中，不論老人送暖、豪雨災後復原及淨灘等志願服務計畫，就這麼擬訂出來了。 兵役勤管科長賴小萍表示，新北市有40萬後備軍人，各區後備輔導中心除協助救災及辦理國防後備事務外，也像謝憲州一樣，積極投入公益活動，從血荒號召捐血、關懷獨居榮民到協助育幼院運作，處處都可以看到後備團體的活躍，不但是協助新北災防的無名英雄，更是全台最大的公益團體。（突發中心陳威叡／新北報導）,突發中心陳威叡,生活
https://tw.news.appledaily.com/life/realtime/20170730/1171905,蘋果日報,尼莎掃新北農損18公頃　文旦柚、芋頭為大宗,,2017-07-30T08:22:00Z,尼莎颱風昨挾帶10到11級陣風侵台，八里、五股區的文旦柚以及北海岸金山、淡水等區的芋頭、筊白筍、香蕉及一期水稻等作物傳出災情，初估農損面積約近18公頃，金額約380萬元，市府已啟動災害通報機制，協助爭取中央的農業天然災害救助。 昨天從中午開始，八里、五股及北海岸地區遭風雨侵襲，現在正值文旦柚以及芋頭、筊白筍生長季節，出現落果以及倒伏、折枝的現象，新北市政府立即啟動農業天然災害查報機制。 經彙整八里、五股、淡水、金山、三芝、石門區公所查報農損情形，初步統計結果，農損被害面積134.48公頃，損害程度約13%，換算面積17.49公頃，農損金額約380萬元，主要包含文旦柚、芋、筊白筍、一期水稻等。 農業局提醒，一期水稻已屆採收期，農業局提醒少數尚未採收的農友，盡速搶收作業，以降低災損，由於高溫高濕條件下，農作物容易發生病害，在風雨後更須注意做好防病措施；中果期至成熟期植株，應檢視並疏通果園排水系統，並進行清園工作，撿拾落果，以防腐爛果實滋生蚊蠅，農業局也將配合農友需求，安排農改場專家協助。 農業局表示，這幾天各地區公所仍然會持續查報各地農損情形，呼籲農友如有發生農損情形，儘速向所在地公所通報。（突發中心曾佳俊／新北報導）【小編推薦】【驚險片】颱風夜在家不安全　婦人關玻璃門遭拍飛尼莎一次吹倒19支電線桿　台電搶修恢復供電尼莎離去海棠接力　台東車站湧現逃難潮【森77】新車底盤多處鏽蝕　車商：鑄鐵材質生鏽斑正常,突發中心曾佳俊,生活
https://tw.news.appledaily.com/local/realtime/20170729/1171338,蘋果日報,​尼莎颱風襲擊　淡水警方驅離觀浪民眾,,2017-07-29T07:24:00Z,依中央氣象局最新資訊，尼莎颱風中心目前在花蓮東南東方約140 公里之海面上，以每小時20轉15公里速度，向西北轉西北西移動，暴風圈已進入臺灣東半部陸地。新北市今天下午將逐漸受到颱風暴風圈影響，淡水河流域首當其衝，為了維護民眾安全，淡水分局警方至淡水渡船頭及淡水河沿岸，勸離釣客與觀浪民眾，並呼籲民眾颱風期間切勿至海岸觀浪、垂釣、無故逗留，避免意外事件發生。 淡水分局表示，淡水區中正東路沿線、中正路老街河岸、三芝區淡金公路大嘉好加油站至三芝市區沿線，都是容易積水、淹水區域。而三芝區101線及101甲線等區域屬易塌崩地區，住在附近的居民要多加注意坍方、落石、土石流及山洪爆發。請民眾做好防颱工作，避免外出及進入山區及河川。若發現淹水或其他災情，請立即撥打110、119報案，或向各區公所的災害應變中心反應。（突發中心黃子騰／新北報導）小編推薦：【搶種意外】颱風天搶插秧　大學女遭堆高機壓傷命危【登山墜谷】登山隊下山躲尼莎　花蓮1登山客墜谷不治樂雅樂男員工「好奇」裝針孔　偷拍4女客如廁、2女員工更衣,突發中心黃子騰,社會
https://tw.news.appledaily.com/life/realtime/20170728/1170847,蘋果日報,​尼莎颱風來襲　白沙灣等4處風景區封閉,,2017-07-28T11:07:00Z,觀光局北海岸及觀音山國家風景區管理處，為因應尼莎颱風來襲，除加強轄內景點設施及在建工程的防颱措施外，包括三芝淺水灣、石門白沙灣、金山中角沙珠灣及基隆和平島等4處海域，即起預警性封閉，並於官網提醒遊客不要前往，以免發生危險。 北觀處表示，中央氣象局根據目前颱風路徑預測，暴風圈可能不會壟罩全台，但全台仍會有風雨，尤其是東半部地區最為明顯，預計暴風圈最快31日將會脫離台灣，提醒民眾注意防颱，確保安全。（突發中心蔡進男／基隆報導）推薦閱讀：尼莎侵台各地風雨預估狀況　《蘋果》幫你總整理【不斷更新】尼莎與熱低壓產生藤原效應　中南部暴雨恐炸到下周五颱風前夕赴澎湖潛水　台中女潛客溺斃何時下雨？下多久？　尼莎颱風天氣懶人包尼莎是不對稱的「禿頭颱」　當心登陸後引進西南氣流釀災,突發中心蔡進男,生活
https://tw.entertainment.appledaily.com/realtime/20170728/1170735,蘋果日報,《叫小賀》男星曬出職業傷害　滿背起水泡駭人,,2017-07-28T10:46:00Z,民視校園喜劇《我的老師叫小賀》因應暑假期間，帶著演員群到三芝的地中海休閒會館拍戲，一連拍了7天的海邊戲，今出現了職業災害，好傻好天真的演員王上豪明天要在台北小巨蛋參加國標舞大賽，為了不用塗抹拉丁膚色膏，拍攝一周來特地不防曬，結果第一天收工後回家整個背部就起水泡，連美少女王顗婷也因為海邊曝曬造成皮膚過敏起紅疹，讓兩人收工後不得不緊急就醫。  劇中飾演金小帥小開的王上豪，在上週經歷被闖紅燈的車子追撞後，第一天在海邊的戲也曬出水泡來，讓他一收工就趕緊去找醫生報到，醫生也嚴厲的警告如果再曬下去傷口怕變成蜂窩性組織炎，讓他不得不聽醫生的話，只是一連碰上讓自己身體受傷的事情，他坦言到現在還不敢跟家人報備，更怕媽媽會擔心。接連幾天王上豪都乖乖服藥，只是傷口的疼痛造成他許多的不便，儘管只是穿起衣服的摩擦感也讓他極度的不舒服，但被醫師警告過後，王上豪連拍戲塗防曬油前還厚敷藥再上防曬，只是因為車禍腳挫傷無法下水，讓他在海邊只能看著別人往水裡跳，他表示也學到教訓，要透過自己的例子讓大家知道夏日防曬的重要性。  另一名飾演女學生的廣告美女王顗婷，也因為自己免疫系統下降，導致用了防曬品之後引發嚴重的脫皮紅腫，讓她收工回家癢到無法入睡。（葉婉如／台北報導）【小編推薦】氣質隨媽咪 李嫣清冷表情復刻王菲更多新聞……潔西卡完美重現Freestyle　錄《型男》最怕吃黃瓜【浮誇片】這不是炸雞排！正妹一秒暴怒郭書瑤只被金陽拍醜照　樂當朋友酒醉抱枕王子控制狂體質　曾之喬控「劉海分叉也要管」10周年展都GD衣服！「BIGBANG」勝利虧：他太有錢了,葉婉如,娛樂
http://tw.news.appledaily.com/headline/daily/20170728/37730073/,蘋果日報,20輛oBike葬溪谷 業者提告,,2017-07-27T21:00:00Z,繼日前大批oBike被棄置新北市觀音山、丟在淡水河畔消波塊上，昨又有20輛oBike遭丟棄在三芝八連溪裡（圖）。網友拍照po網，紛紛有人留言「腳踏車跟他們有仇嗎」、「這樣解決不了問題，而是在製造問題啊」，並呼籲「這樣只會污染環境，大家要理智」。經營oBike的台灣奧致網絡科技有限公司接獲警方通知後，已派員將車輛吊回，並提起毀損告訴，追究行為人責任。文╱李易昌•圖╱翻攝阮厝住三芝臉書社團,,頭條要聞
https://tw.news.appledaily.com/local/realtime/20170727/1169672,蘋果日報,【共享悲劇片】數十輛oBike葬身河底　網友：有仇嗎？,,2017-07-27T10:40:00Z,（新增：二版影片）oBike繼日前被民眾發現被棄置在觀音山遊客服務中心、淡水河消波塊上，今又有民眾發現有數十輛oBike遭丟棄在三芝八連溪內，網友見狀紛紛留言「這腳踏車跟他們有仇嗎」、「這樣解決不了問題，這樣是在製造問題啊」、「這樣只會汙染環境，大家要理智」，也有民眾反諷「台灣最美的風景就是人」等語句，並呼籲廠商儘快將oBike回收。（突發中心李易昌／新北報導）發稿時間：14：15修改時間：18：40推薦閱讀:尼莎海警最快明發布　周末恐直撲穿越台灣【有片】小黃迴轉遭酒駕車撞　波及2無辜路人世大運招募小黃代駕　開大七派頭迎賓更多新聞……這樣問飲料太兇了　不科學！臉還撞臉女藝人李姸憬運將互毆雙起訴　判決結果出爐,突發中心李易昌,社會
